{
  "schema_version": "theme-new-papers-v1",
  "kind": "theme-new-papers",
  "theme": "Diffusion Models",
  "slug": "diffusion-models",
  "generated_at": "2026-10-25T04:20:00Z",
  "source": "openalex",
  "window": {
    "from": "2026-09-26",
    "to": "2026-10-25",
    "days": 30
  },
  "lineage_generated_at": "2026-10-25T04:19:59.102000Z",
  "anchor_count": 60,
  "min_lineage_cites": 2,
  "topic_gate": {
    "method": "embedding+terms",
    "model": "Xenova/bge-small-en-v1.5",
    "revision": "ea104dacec62c0de699686887e3f920caeb4f3e3",
    "thresholds": {
      "z_lo": 0,
      "z_hi": 1
    },
    "pool_size": 300
  },
  "stats": {
    "fetched": 240,
    "in_lineage": 0,
    "excluded_type": 2,
    "below_min_cites": 163,
    "pages": 2,
    "truncated": false,
    "off_topic": 68,
    "kept": 7,
    "capped": 0
  },
  "items": [
    {
      "id": "openalex:W7220906625",
      "title": "Encoder relationships govern selectivity in embedding-space attacks on text-to-image diffusion models",
      "publication_date": "2026-10-08",
      "year": 2026,
      "authors": [
        "Hyun Kwon",
        "Jang-Woon Baek"
      ],
      "authors_truncated": false,
      "venue": "Discover Computing",
      "type": "article",
      "doi": "10.1007/s10791-026-10649-1",
      "arxiv_id": null,
      "url": "https://doi.org/10.1007/s10791-026-10649-1",
      "cites_lineage": [
        "openalex:W4312933868",
        "openalex:W4386066536",
        "openalex:W4390871724",
        "openalex:W4390872921",
        "openalex:W4390874260",
        "openalex:W4402713133",
        "openalex:W7133244780"
      ],
      "topic": {
        "admitted_by": "topic",
        "z": 1.031
      }
    },
    {
      "id": "openalex:W7220378364",
      "title": "A paradigm-driven review of diffusion models for image restoration",
      "publication_date": "2026-10-05",
      "year": 2026,
      "authors": [
        "Zican Lin",
        "Yichi Zhang",
        "Xinyu Yang"
      ],
      "authors_truncated": false,
      "venue": "Neurocomputing",
      "type": "article",
      "doi": "10.1016/j.neucom.2026.135282",
      "arxiv_id": null,
      "url": "https://doi.org/10.1016/j.neucom.2026.135282",
      "cites_lineage": [
        "openalex:W3036167779",
        "openalex:W3122887982",
        "openalex:W3162926177",
        "openalex:W3212516020",
        "openalex:W4312497550",
        "openalex:W4385800876"
      ],
      "topic": {
        "admitted_by": "topic",
        "z": 1.616
      }
    },
    {
      "id": "openalex:W7221559357",
      "title": "MammoDiff: weakly supervised mammographic anomaly detection via classifier-guided denoising diffusion models—a real-world clinical study on the KHCC mammography cohort",
      "publication_date": "2026-10-12",
      "year": 2026,
      "authors": [
        "Ahmad Nawaf Nasayreh",
        "Nagham Osman",
        "Laila Tahoun",
        "Asem Mansour",
        "Iyad Yasin Sultan"
      ],
      "authors_truncated": false,
      "venue": "Frontiers in Medical Technology",
      "type": "article",
      "doi": "10.3389/fmedt.2026.1912196",
      "arxiv_id": null,
      "url": "https://doi.org/10.3389/fmedt.2026.1912196",
      "cites_lineage": [
        "openalex:W3036167779",
        "openalex:W3122887982",
        "openalex:W3162926177"
      ],
      "topic": {
        "admitted_by": "topic",
        "z": 0.088
      }
    },
    {
      "id": "openalex:W7222994154",
      "title": "Boosting the understanding ability of diffusion model with masked image modeling",
      "publication_date": "2026-10-01",
      "year": 2026,
      "authors": [
        "Jianning Pei",
        "Yingchao Feng",
        "Hanbo Bi",
        "Wenhui Diao",
        "Zhi Guo"
      ],
      "authors_truncated": true,
      "venue": "Pattern Recognition",
      "type": "article",
      "doi": "10.1016/j.patcog.2026.115123",
      "arxiv_id": null,
      "url": "https://doi.org/10.1016/j.patcog.2026.115123",
      "cites_lineage": [
        "openalex:W4312933868",
        "openalex:W4390872297",
        "openalex:W4390873054"
      ],
      "topic": {
        "admitted_by": "topic",
        "z": 1.669
      }
    },
    {
      "id": "openalex:W7221781796",
      "title": "DiffuChannel: A Conditional Denoising Diffusion Model that Synthesises Single-Molecule Patch-Clamp Data with Exactly Known Idealisation (Ground Truth)",
      "publication_date": "2026-10-14",
      "year": 2026,
      "authors": [
        "Samuel A. Ball",
        "Richard Barrett‐Jolley"
      ],
      "authors_truncated": false,
      "venue": "bioRxiv (Cold Spring Harbor Laboratory)",
      "type": "preprint",
      "doi": "10.64898/2026.10.13.757650",
      "arxiv_id": null,
      "url": "https://doi.org/10.64898/2026.10.13.757650",
      "cites_lineage": [
        "openalex:W4312497550",
        "openalex:W4312933868"
      ],
      "topic": {
        "admitted_by": "topic",
        "z": 0.862
      }
    },
    {
      "id": "openalex:W7214624074",
      "title": "AFAD-Net: scene-adaptive diffusion model with Frequency-spatial logic for Remote Sensing Image Super-Resolution",
      "publication_date": "2026-09-28",
      "year": 2026,
      "authors": [
        "Ce Jiang",
        "Qiong Song",
        "Weifeng Liu",
        "Tao Dapeng",
        "Baodi Liu"
      ],
      "authors_truncated": true,
      "venue": "International Journal of Remote Sensing",
      "type": "article",
      "doi": "10.1080/01431161.2026.2735048",
      "arxiv_id": null,
      "url": "https://doi.org/10.1080/01431161.2026.2735048",
      "cites_lineage": [
        "openalex:W4312933868",
        "openalex:W4390872297"
      ],
      "topic": {
        "admitted_by": "topic",
        "z": 0.395
      }
    },
    {
      "id": "openalex:W7214440328",
      "title": "Conditional Diffusion Model to Predict Structural Wind Loading Using Data from Sparse Sensors",
      "publication_date": "2026-09-26",
      "year": 2026,
      "authors": [
        "Zhixin Liu",
        "Yu Zhang",
        "Haotian Dong",
        "Shouqiang Wang"
      ],
      "authors_truncated": false,
      "venue": "Journal of Structural Engineering",
      "type": "article",
      "doi": "10.1061/jsendh.steng-16666",
      "arxiv_id": null,
      "url": "https://doi.org/10.1061/jsendh.steng-16666",
      "cites_lineage": [
        "openalex:W4312933868",
        "openalex:W4360884927"
      ],
      "topic": {
        "admitted_by": "topic",
        "z": 0.398
      }
    }
  ]
}
