{
  "schema_version": "theme-new-papers-v1",
  "kind": "theme-new-papers",
  "theme": "Chain-of-Thought Prompting",
  "slug": "chain-of-thought-prompting",
  "generated_at": "2026-10-27T15:09:02Z",
  "source": "openalex",
  "window": {
    "from": "2026-09-28",
    "to": "2026-10-27",
    "days": 30
  },
  "lineage_generated_at": "2026-10-27T15:09:01.391000Z",
  "anchor_count": 23,
  "min_lineage_cites": 2,
  "topic_gate": {
    "method": "embedding+terms",
    "model": "Xenova/bge-small-en-v1.5",
    "revision": "ea104dacec62c0de699686887e3f920caeb4f3e3",
    "thresholds": {
      "z_lo": 0,
      "z_hi": 1
    },
    "pool_size": 280
  },
  "stats": {
    "fetched": 257,
    "in_lineage": 0,
    "excluded_type": 1,
    "below_min_cites": 228,
    "pages": 2,
    "truncated": false,
    "off_topic": 26,
    "kept": 2,
    "capped": 0
  },
  "items": [
    {
      "id": "openalex:W7216548972",
      "title": "Unleashing Chain-of-Thought Style Reasoning for Text-to-Speech Systems",
      "publication_date": "2026-10-02",
      "year": 2026,
      "authors": [
        "Ziyue Jiang",
        "Zhou Zhao"
      ],
      "authors_truncated": false,
      "venue": "INTERNATIONAL CONFERENCE ON MULTIMODAL INTERACTION",
      "type": "conference-paper",
      "doi": "10.1145/3776574.3831131",
      "arxiv_id": null,
      "url": "https://doi.org/10.1145/3776574.3831131",
      "cites_lineage": [
        "openalex:W4393160302",
        "openalex:W7133224126"
      ],
      "topic": {
        "admitted_by": "topic",
        "z": 1.625
      }
    },
    {
      "id": "openalex:W4415318396",
      "title": "SEER: Self-Enhancing Chain-of-Thought Compression for Reasoning Models",
      "publication_date": "2026-10-01",
      "year": 2026,
      "authors": [
        "Kerui Huang",
        "Shuhan Liu",
        "Xing Hu",
        "Tongtong Xu",
        "Lingfeng Bao"
      ],
      "authors_truncated": true,
      "venue": "Proceedings of the ACM on software engineering.",
      "type": "article",
      "doi": "10.1145/3832120",
      "arxiv_id": "2509.14093",
      "url": "https://doi.org/10.1145/3832120",
      "cites_lineage": [
        "openalex:W4221161695",
        "openalex:W4281483047"
      ],
      "topic": {
        "admitted_by": "topic",
        "z": 1.75
      }
    }
  ]
}
